{
  "schema": "emberwalk.motion/1",
  "synthetic": true,
  "label": "Synthetic sample house",
  "scene": "test-yard",
  "fps": 30,
  "frame_count": 600,
  "duration_s": 20,
  "camera": {
    "width_px": 1920,
    "height_px": 1080,
    "focal_mm": 26,
    "sensor_width_mm": 36,
    "sensor_fit": "horizontal",
    "hfov_deg": 69.39,
    "vfov_deg": 42.554
  },
  "conventions": {
    "pos_in": "inches in scene axes: x along the wall from its right end as seen from the yard, y out from the wall face, z up from the ground",
    "heading_deg": "compass style about z: 0 looks out along +y, 90 along +x, 180 faces the wall",
    "tilt_deg": "degrees below the horizon",
    "roll_deg": "turn about the view axis, positive when the top of the phone turns right as the holder sees it",
    "t": "seconds from the first frame"
  },
  "samples": [
    {"frame": 1, "t": 0.0, "pos_in": [72.0, 144.0, 54.0], "heading_deg": 180.421, "tilt_deg": 17.431, "roll_deg": 0.637},
    {"frame": 2, "t": 0.033333, "pos_in": [72.0, 144.0, 54.0], "heading_deg": 180.514, "tilt_deg": 17.482, "roll_deg": 0.61},
    {"frame": 3, "t": 0.066667, "pos_in": [72.0, 144.0, 54.0], "heading_deg": 180.597, "tilt_deg": 17.53, "roll_deg": 0.579},
    {"frame": 4, "t": 0.1, "pos_in": [72.0, 144.0, 54.0], "heading_deg": 180.669, "tilt_deg": 17.576, "roll_deg": 0.544},
    {"frame": 5, "t": 0.133333, "pos_in": [72.0, 144.0, 54.0], "heading_deg": 180.73, "tilt_deg": 17.62, "roll_deg": 0.505},
    {"frame": 6, "t": 0.166667, "pos_in": [72.0, 144.0, 54.0], "heading_deg": 180.779, "tilt_deg": 17.661, "roll_deg": 0.463},
    {"frame": 7, "t": 0.2, "pos_in": [72.0, 144.0, 54.0], "heading_deg": 180.817, "tilt_deg": 17.699, "roll_deg": 0.418},
    {"frame": 8, "t": 0.233333, "pos_in": [72.0, 144.0, 54.0], "heading_deg": 180.843, "tilt_deg": 17.734, "roll_deg": 0.369},
    {"frame": 9, "t": 0.266667, "pos_in": [72.01, 144.0, 54.0], "heading_deg": 180.859, "tilt_deg": 17.766, "roll_deg": 0.318},
    {"frame": 10, "t": 0.3, "pos_in": [72.01, 144.0, 54.0], "heading_deg": 180.865, "tilt_deg": 17.795, "roll_deg": 0.265},
    {"frame": 11, "t": 0.333333, "pos_in": [72.01, 144.0, 54.0], "heading_deg": 180.861, "tilt_deg": 17.82, "roll_deg": 0.21},
    {"frame": 12, "t": 0.366667, "pos_in": [72.01, 144.0, 54.0], "heading_deg": 180.85, "tilt_deg": 17.842, "roll_deg": 0.153},
    {"frame": 13, "t": 0.4, "pos_in": [72.02, 144.0, 54.0], "heading_deg": 180.831, "tilt_deg": 17.861, "roll_deg": 0.096},
    {"frame": 14, "t": 0.433333, "pos_in": [72.02, 144.0, 54.0], "heading_deg": 180.808, "tilt_deg": 17.876, "roll_deg": 0.037},
    {"frame": 15, "t": 0.466667, "pos_in": [72.03, 144.0, 54.0], "heading_deg": 180.78, "tilt_deg": 17.888, "roll_deg": -0.022},
    {"frame": 16, "t": 0.5, "pos_in": [72.03, 144.0, 54.0], "heading_deg": 180.75, "tilt_deg": 17.896, "roll_deg": -0.08},
    {"frame": 17, "t": 0.533333, "pos_in": [72.04, 144.0, 54.0], "heading_deg": 180.719, "tilt_deg": 17.901, "roll_deg": -0.139},
    {"frame": 18, "t": 0.566667, "pos_in": [72.05, 144.0, 54.0], "heading_deg": 180.688, "tilt_deg": 17.902, "roll_deg": -0.196},
    {"frame": 19, "t": 0.6, "pos_in": [72.06, 144.0, 54.0], "heading_deg": 180.659, "tilt_deg": 17.899, "roll_deg": -0.252},
    {"frame": 20, "t": 0.633333, "pos_in": [72.07, 144.0, 54.01], "heading_deg": 180.634, "tilt_deg": 17.892, "roll_deg": -0.307},
    {"frame": 21, "t": 0.666667, "pos_in": [72.08, 144.0, 54.01], "heading_deg": 180.614, "tilt_deg": 17.88, "roll_deg": -0.359},
    {"frame": 22, "t": 0.7, "pos_in": [72.1, 144.0, 54.01], "heading_deg": 180.599, "tilt_deg": 17.864, "roll_deg": -0.409},
    {"frame": 23, "t": 0.733333, "pos_in": [72.11, 143.99, 54.01], "heading_deg": 180.591, "tilt_deg": 17.845, "roll_deg": -0.456},
    {"frame": 24, "t": 0.766667, "pos_in": [72.12, 143.99, 54.01], "heading_deg": 180.591, "tilt_deg": 17.821, "roll_deg": -0.499},
    {"frame": 25, "t": 0.8, "pos_in": [72.14, 143.99, 54.0], "heading_deg": 180.599, "tilt_deg": 17.793, "roll_deg": -0.539},
    {"frame": 26, "t": 0.833333, "pos_in": [72.16, 143.99, 54.0], "heading_deg": 180.615, "tilt_deg": 17.762, "roll_deg": -0.575},
    {"frame": 27, "t": 0.866667, "pos_in": [72.18, 143.99, 53.99], "heading_deg": 180.64, "tilt_deg": 17.728, "roll_deg": -0.607},
    {"frame": 28, "t": 0.9, "pos_in": [72.2, 143.99, 53.99], "heading_deg": 180.674, "tilt_deg": 17.692, "roll_deg": -0.635},
    {"frame": 29, "t": 0.933333, "pos_in": [72.22, 143.99, 53.99], "heading_deg": 180.715, "tilt_deg": 17.653, "roll_deg": -0.658},
    {"frame": 30, "t": 0.966667, "pos_in": [72.25, 143.99, 53.98], "heading_deg": 180.764, "tilt_deg": 17.613, "roll_deg": -0.676},
    {"frame": 31, "t": 1.0, "pos_in": [72.28, 143.99, 53.98], "heading_deg": 180.82, "tilt_deg": 17.572, "roll_deg": -0.689},
    {"frame": 32, "t": 1.033333, "pos_in": [72.3, 143.99, 53.98], "heading_deg": 180.881, "tilt_deg": 17.529, "roll_deg": -0.696},
    {"frame": 33, "t": 1.066667, "pos_in": [72.34, 144.0, 53.99], "heading_deg": 180.947, "tilt_deg": 17.484, "roll_deg": -0.699},
    {"frame": 34, "t": 1.1, "pos_in": [72.37, 144.0, 54.0], "heading_deg": 181.016, "tilt_deg": 17.437, "roll_deg": -0.697},
    {"frame": 35, "t": 1.133333, "pos_in": [72.4, 144.0, 54.01], "heading_deg": 181.086, "tilt_deg": 17.388, "roll_deg": -0.69},
    {"frame": 36, "t": 1.166667, "pos_in": [72.44, 144.01, 54.01], "heading_deg": 181.156, "tilt_deg": 17.336, "roll_deg": -0.677},
    {"frame": 37, "t": 1.2, "pos_in": [72.48, 144.01, 54.02], "heading_deg": 181.224, "tilt_deg": 17.282, "roll_deg": -0.66},
    {"frame": 38, "t": 1.233333, "pos_in": [72.52, 144.01, 54.03], "heading_deg": 181.289, "tilt_deg": 17.224, "roll_deg": -0.639},
    {"frame": 39, "t": 1.266667, "pos_in": [72.56, 144.02, 54.03], "heading_deg": 181.348, "tilt_deg": 17.164, "roll_deg": -0.613},
    {"frame": 40, "t": 1.3, "pos_in": [72.61, 144.02, 54.03], "heading_deg": 181.401, "tilt_deg": 17.101, "roll_deg": -0.583},
    {"frame": 41, "t": 1.333333, "pos_in": [72.65, 144.02, 54.02], "heading_deg": 181.446, "tilt_deg": 17.037, "roll_deg": -0.549},
    {"frame": 42, "t": 1.366667, "pos_in": [72.7, 144.02, 54.01], "heading_deg": 181.48, "tilt_deg": 16.973, "roll_deg": -0.512},
    {"frame": 43, "t": 1.4, "pos_in": [72.75, 144.02, 54.0], "heading_deg": 181.504, "tilt_deg": 16.91, "roll_deg": -0.471},
    {"frame": 44, "t": 1.433333, "pos_in": [72.81, 144.02, 53.98], "heading_deg": 181.515, "tilt_deg": 16.848, "roll_deg": -0.428},
    {"frame": 45, "t": 1.466667, "pos_in": [72.87, 144.02, 53.97], "heading_deg": 181.514, "tilt_deg": 16.79, "roll_deg": -0.382},
    {"frame": 46, "t": 1.5, "pos_in": [72.93, 144.02, 53.96], "heading_deg": 181.499, "tilt_deg": 16.734, "roll_deg": -0.334},
    {"frame": 47, "t": 1.533333, "pos_in": [72.99, 144.02, 53.96], "heading_deg": 181.471, "tilt_deg": 16.683, "roll_deg": -0.284},
    {"frame": 48, "t": 1.566667, "pos_in": [73.06, 144.02, 53.96], "heading_deg": 181.428, "tilt_deg": 16.635, "roll_deg": -0.233},
    {"frame": 49, "t": 1.6, "pos_in": [73.12, 144.01, 53.97], "heading_deg": 181.372, "tilt_deg": 16.59, "roll_deg": -0.18},
    {"frame": 50, "t": 1.633333, "pos_in": [73.19, 144.01, 53.98], "heading_deg": 181.303, "tilt_deg": 16.547, "roll_deg": -0.126},
    {"frame": 51, "t": 1.666667, "pos_in": [73.27, 144.0, 54.0], "heading_deg": 181.221, "tilt_deg": 16.505, "roll_deg": -0.072},
    {"frame": 52, "t": 1.7, "pos_in": [73.35, 143.99, 54.02], "heading_deg": 181.128, "tilt_deg": 16.464, "roll_deg": -0.017},
    {"frame": 53, "t": 1.733333, "pos_in": [73.42, 143.99, 54.04], "heading_deg": 181.025, "tilt_deg": 16.422, "roll_deg": 0.038},
    {"frame": 54, "t": 1.766667, "pos_in": [73.51, 143.98, 54.05], "heading_deg": 180.913, "tilt_deg": 16.379, "roll_deg": 0.092},
    {"frame": 55, "t": 1.8, "pos_in": [73.59, 143.97, 54.06], "heading_deg": 180.794, "tilt_deg": 16.336, "roll_deg": 0.147},
    {"frame": 56, "t": 1.833333, "pos_in": [73.68, 143.97, 54.06], "heading_deg": 180.669, "tilt_deg": 16.291, "roll_deg": 0.2},
    {"frame": 57, "t": 1.866667, "pos_in": [73.78, 143.96, 54.05], "heading_deg": 180.541, "tilt_deg": 16.248, "roll_deg": 0.253},
    {"frame": 58, "t": 1.9, "pos_in": [73.87, 143.96, 54.03], "heading_deg": 180.412, "tilt_deg": 16.206, "roll_deg": 0.305},
    {"frame": 59, "t": 1.933333, "pos_in": [73.97, 143.96, 54.01], "heading_deg": 180.283, "tilt_deg": 16.169, "roll_deg": 0.355},
    {"frame": 60, "t": 1.966667, "pos_in": [74.07, 143.95, 53.98], "heading_deg": 180.156, "tilt_deg": 16.137, "roll_deg": 0.404},
    {"frame": 61, "t": 2.0, "pos_in": [74.18, 143.95, 53.96], "heading_deg": 180.033, "tilt_deg": 16.112, "roll_deg": 0.45},
    {"frame": 62, "t": 2.033333, "pos_in": [74.29, 143.96, 53.94], "heading_deg": 179.915, "tilt_deg": 16.095, "roll_deg": 0.495},
    {"frame": 63, "t": 2.066667, "pos_in": [74.4, 143.96, 53.92], "heading_deg": 179.805, "tilt_deg": 16.086, "roll_deg": 0.536},
    {"frame": 64, "t": 2.1, "pos_in": [74.52, 143.97, 53.92], "heading_deg": 179.703, "tilt_deg": 16.086, "roll_deg": 0.575},
    {"frame": 65, "t": 2.133333, "pos_in": [74.64, 143.97, 53.93], "heading_deg": 179.611, "tilt_deg": 16.094, "roll_deg": 0.61},
    {"frame": 66, "t": 2.166667, "pos_in": [74.76, 143.98, 53.95], "heading_deg": 179.529, "tilt_deg": 16.107, "roll_deg": 0.642},
    {"frame": 67, "t": 2.2, "pos_in": [74.89, 143.99, 53.98], "heading_deg": 179.459, "tilt_deg": 16.123, "roll_deg": 0.669},
    {"frame": 68, "t": 2.233333, "pos_in": [75.02, 144.0, 54.01], "heading_deg": 179.4, "tilt_deg": 16.142, "roll_deg": 0.692},
    {"frame": 69, "t": 2.266667, "pos_in": [75.15, 144.02, 54.04], "heading_deg": 179.352, "tilt_deg": 16.16, "roll_deg": 0.711},
    {"frame": 70, "t": 2.3, "pos_in": [75.29, 144.03, 54.07], "heading_deg": 179.316, "tilt_deg": 16.176, "roll_deg": 0.723},
    {"frame": 71, "t": 2.333333, "pos_in": [75.43, 144.04, 54.09], "heading_deg": 179.291, "tilt_deg": 16.189, "roll_deg": 0.731},